{
  "$schema": "../schema/chat-schema-0.2.json",
  "version": "0.2",
  "type": "chat",
  "vendor": "google",
  "model": {
    "name": "chat-bison"
  },
  "history": [
    {
      "input": "1+1=ï¼Ÿ",
      "output": "1+1=3!"
    }
  ],
  "question": "Write a hello world in js",
  "parameters": [
    {
      "name": "temperature",
      "value": 0.1
    }
  ]
}
